{
  "schemaVersion": 1,
  "id": "yiliyun-security-best-practice",
  "status": "published",
  "title": "企业文件安全协作的五个实践",
  "summary": "从目录规划到权限边界，五个可落地的做法让企业文件既好协作、又守得住边界。",
  "updatedAt": "2026-08-08",
  "publishedAt": "2026-08-08",
  "cover": {"src": "media/yiliyun/hero.png", "alt": "企业文件安全协作的五个实践示意图"},
  "blocks": [
    {"type": "paragraph", "text": "企业文件的难点往往不是「存得下」，而是「既好协作、又守得住边界」。结合企业网盘的实际使用，我们整理了五个可落地的做法。"},
    {"type": "list", "items": ["先规划目录再放文件：部门、项目、个人分层清晰", "敏感资料单独设权限：下载、外发、复制分级限制", "统一归档命名：让版本和目录都有章可循", "关键操作留痕：配合审计形成闭环", "人员变动及时调权：权限不随人走"]},
    {"type": "heading", "level": 2, "text": "权限不是限制，是让共享更放心"},
    {"type": "paragraph", "text": "清晰的权限边界，反而能让团队更敢于共享。因为每个人都知道什么可以分享、什么需要保护，协作的安全感来自规则，而不是犹豫。"},
    {"type": "quote", "text": "好的文件体系，让下一位使用者少问一个问题。", "attribution": "一粒云客户成功团队"}
  ],
  "seo": {
    "title": "企业文件安全协作的五个实践 | 一粒云",
    "description": "五个可落地的做法，让企业文件既好协作、又守得住边界。",
    "keywords": ["文件安全", "权限管理", "企业网盘", "最佳实践", "一粒云"],
    "image": "media/yiliyun/hero.png"
  }
}
