{
  "schemaVersion": 1,
  "id": "yiliyun-ai-site-launch",
  "status": "published",
  "title": "AI 微站正式发布：把云盘资料一键发布成官网，想改什么直接说",
  "summary": "一粒云 AI 微站上线：企业云盘里的产品资料、案例与动态可一键发布成官网，并由 AI 自动完成内容更新——想改什么，直接说。",
  "updatedAt": "2026-08-14",
  "publishedAt": "2026-08-14",
  "cover": {"src": "media/yiliyun/hero.png", "alt": "一粒云 AI 微站把云盘资料一键发布成可持续更新的官网"},
  "blocks": [
    {"type": "paragraph", "text": "一粒云 AI 微站正式发布。这是企业文件协作与内容发布的一次打通：把云盘里已经沉淀好的产品资料、案例与动态，一键发布成官网，并借助 AI 自动完成内容更新，让企业官网真正随资料一起生长。"},
    {"type": "heading", "level": 2, "text": "一键发布，资料即官网"},
    {"type": "paragraph", "text": "企业不再需要专业建站团队。云盘里的产品手册、能力说明、客户案例与新闻动态，按企业级响应式模板一键发布，即可生成可访问的官网与客户门户。"},
    {"type": "list", "items": ["产品资料、案例与动态按模板一键生成官网", "支持首页、产品、案例、新闻、下载、FAQ 等页面类型", "企业级响应式模板，PC 与移动端都清晰"]},
    {"type": "heading", "level": 2, "text": "AI 自动更新，想改什么直接说"},
    {"type": "paragraph", "text": "AI 微站与一粒云 AI CMS 一脉相承。发布之后，想改产品说明、加一篇新闻、调整页面结构，直接用自然语言告诉 AI，AI 自动完成改版与发布，全程无需写代码。"},
    {"type": "list", "items": ["用自然语言描述更新需求，AI 自动执行", "产品资料一变，官网内容跟着同步", "发布基于授权资料，内容边界全程可控"]},
    {"type": "heading", "level": 2, "text": "内容单一来源，不再重复维护"},
    {"type": "paragraph", "text": "官网内容直接来自企业云盘，企业只需维护一套资料，官网自动承接。这既减少了重复整理的工作，也让对外内容始终与内部资料保持一致。"},
    {"type": "quote", "text": "AI 微站要做的，是让企业官网成为云盘资料的自然延伸——资料更新，官网就更新。", "attribution": "一粒云产品团队"}
  ],
  "seo": {
    "title": "AI 微站正式发布：把云盘资料一键发布成官网 | 一粒云",
    "description": "一粒云 AI 微站把云盘资料一键发布成官网，AI 自动更新新闻与内容，想改什么直接说。",
    "keywords": ["AI微站", "一键建站", "AI更新", "企业官网", "内容发布", "一粒云"],
    "image": "media/yiliyun/hero.png"
  }
}
