{
  "schemaVersion": 1,
  "id": "yiliyun-release-v2",
  "status": "published",
  "title": "一粒云企业网盘 2.0 发布：更安全的外链分享与更细的权限",
  "summary": "本次更新带来受控外链、文件级权限与审计记录升级，让企业文件协作更安全、更可控。",
  "updatedAt": "2026-08-12",
  "publishedAt": "2026-08-12",
  "cover": {"src": "media/yiliyun/hero.png", "alt": "一粒云企业网盘 2.0 安全外链分享界面"},
  "blocks": [
    {"type": "paragraph", "text": "一粒云企业网盘 2.0 正式发布。本次更新聚焦「更安全的外链分享」与「更细的权限管控」，帮助企业把文件协作的边界做得更清楚。"},
    {"type": "heading", "level": 2, "text": "受控外链，交付更规范"},
    {"type": "paragraph", "text": "对外分享现在支持设置有效期、访问密码与下载策略，链接可集中管理与一键回收。客户交付、供应商协作与对外资料传递，不再依赖邮件附件或第三方网盘。"},
    {"type": "list", "items": ["外链设置有效期，到期自动失效", "访问密码保护，仅授权对象可见", "下载与转发策略可灵活配置", "外发操作全程留痕"]},
    {"type": "heading", "level": 2, "text": "文件级权限，边界更精确"},
    {"type": "paragraph", "text": "权限管控升级到文件级，可对单个文件或目录设置访问、下载与外发策略，并随企业组织架构自动调整，让权限不随人走。"},
    {"type": "quote", "text": "企业文件协作的价值，在于把权限和边界做得足够清楚，让每一次共享都放心。", "attribution": "一粒云产品团队"}
  ],
  "seo": {
    "title": "一粒云企业网盘 2.0 发布：更安全的外链与更细的权限 | 一粒云",
    "description": "一粒云企业网盘 2.0 带来受控外链、文件级权限与审计记录升级。",
    "keywords": ["一粒云", "企业网盘", "版本发布", "安全外链", "权限管控"],
    "image": "media/yiliyun/hero.png"
  }
}
